{
  "schemaVersion": 1,
  "recipeId": "scgpt-whole-human-linux-x86_64-cpu",
  "recipeVersion": "1.0.0",
  "boxId": "scgpt-whole-human",
  "modelId": "bowang-scgpt-whole-human",
  "runtimeId": "single-cell-foundation-scgpt-whole-human",
  "version": "0.2.5-beta.1",
  "sourceRevision": "cebd6fae655b9c585a4807daa3ac31bb764f06b4",
  "target": {
    "platform": "linux",
    "arch": "x86_64",
    "accelerator": "cpu"
  },
  "compatibility": {
    "minLiatirVersion": "0.2.1",
    "minRamGb": 16
  },
  "pythonVersion": "3.11.9",
  "uvVersion": "0.11.28",
  "torchBackend": "cpu",
  "requirementsInput": "requirements.in",
  "requirementsLock": "requirements.lock",
  "dependencyLicenseAudit": "runtime-boxes/legal/audits/scgpt-whole-human-linux-x86_64-cpu.json",
  "pythonEntryPoint": "venv/bin/python",
  "modelCacheSubdir": "model-cache/scgpt-whole-human",
  "assetBaseUrl": "https://assets.models.liatir.com/ai-runtime-boxes",
  "assets": [
    {
      "url": "https://drive.usercontent.google.com/download?id=1hh2zGKyWAx3DyovD30GStZ3QlzmSqdk1&export=download&confirm=t",
      "relativePath": "model-cache/scgpt-whole-human/args.json",
      "sizeBytes": 1300,
      "sha256": "c18e075e018140cb8b2d9029387b9de26607a5ce6a8ccabd6ead70cd76b95d60"
    },
    {
      "url": "https://drive.usercontent.google.com/download?id=14AebJfGOUF047Eg40hk57HCtrb0fyDTm&export=download&confirm=t",
      "relativePath": "model-cache/scgpt-whole-human/best_model.pt",
      "sizeBytes": 205385258,
      "sha256": "6cb5d451ab5c4b33eb673adbe4fddc61d2389df1b89b7651a9fe2e557572b922"
    },
    {
      "url": "https://drive.usercontent.google.com/download?id=1H3E_MJ-Dl36AQV6jLbna2EdvgPaqvqcC&export=download&confirm=t",
      "relativePath": "model-cache/scgpt-whole-human/vocab.json",
      "sizeBytes": 1317639,
      "sha256": "acca93d114ca62c3f0f50debbd23e8c87f0714f4737764454f6b2b13f2e8580f"
    },
    {
      "url": "https://codeload.github.com/bowang-lab/scGPT/zip/cebd6fae655b9c585a4807daa3ac31bb764f06b4",
      "relativePath": ".sources/scgpt-source.zip",
      "sizeBytes": 12117557,
      "sha256": "1b825a687b4855dbb8c7b530f17cc246ef677d93d0e2df3fbc82330ff9d189db"
    }
  ],
  "assetArchives": [
    {
      "relativePath": ".sources/scgpt-source.zip",
      "format": "zip",
      "destination": "source/scGPT",
      "stripComponents": 1,
      "removeAfterExtract": true
    }
  ],
  "prunePaths": [
    "source/scGPT/CLAUDE-AUTO-WORKFLOWS.md",
    "source/scGPT/README.md",
    "source/scGPT/data",
    "source/scGPT/docs",
    "source/scGPT/examples",
    "source/scGPT/poetry.lock",
    "source/scGPT/pyproject.toml",
    "source/scGPT/scripts",
    "source/scGPT/tests",
    "source/scGPT/tutorials",
    "source/scGPT/scgpt/__init__.py",
    "source/scGPT/scgpt/data_collator.py",
    "source/scGPT/scgpt/data_sampler.py",
    "source/scGPT/scgpt/loss.py",
    "source/scGPT/scgpt/model/__init__.py",
    "source/scGPT/scgpt/model/generation_model.py",
    "source/scGPT/scgpt/model/multiomic_model.py",
    "source/scGPT/scgpt/preprocess.py",
    "source/scGPT/scgpt/scbank",
    "source/scGPT/scgpt/tasks",
    "source/scGPT/scgpt/tokenizer/__init__.py",
    "source/scGPT/scgpt/tokenizer/default_census_vocab.json",
    "source/scGPT/scgpt/tokenizer/default_gene_vocab.json",
    "source/scGPT/scgpt/trainer.py",
    "source/scGPT/scgpt/utils",
    "venv/lib/python3.11/ensurepip",
    "venv/lib/python3.11/distutils",
    "venv/lib/python3.11/idlelib",
    "venv/lib/python3.11/lib2to3",
    "venv/lib/python3.11/pydoc_data",
    "venv/lib/python3.11/tkinter",
    "venv/lib/python3.11/site-packages/pip",
    "venv/lib/python3.11/site-packages/pip-24.1.2.dist-info",
    "venv/lib/python3.11/site-packages/pkg_resources",
    "venv/lib/python3.11/site-packages/setuptools",
    "venv/lib/python3.11/site-packages/setuptools-70.3.0.dist-info",
    "venv/lib/python3.11/site-packages/torch/include"
  ],
  "selfTest": {
    "imports": ["torch", "anndata", "numpy", "scipy", "pandas", "h5py", "tqdm"],
    "files": [
      "model-cache/scgpt-whole-human/args.json",
      "model-cache/scgpt-whole-human/best_model.pt",
      "model-cache/scgpt-whole-human/vocab.json",
      "source/scGPT/LICENSE",
      "source/scGPT/scgpt/model/model.py",
      "source/scGPT/scgpt/tokenizer/gene_tokenizer.py"
    ],
    "pythonCode": "from pathlib import Path\ncheckpoint = torch.load(Path('model-cache/scgpt-whole-human/best_model.pt'), map_location='cpu', weights_only=False)\nassert checkpoint['encoder.embedding.weight'].shape == (60697, 512)\nassert checkpoint['transformer_encoder.layers.0.self_attn.Wqkv.weight'].shape == (1536, 512)\nassert torch.version.cuda is None\nassert not torch.cuda.is_available()"
  }
}
