{
  "schemaVersion": 1,
  "recipeId": "geneformer-v1-10m-macos-arm64-metal",
  "recipeVersion": "1.0.0",
  "boxId": "geneformer-v1-10m",
  "modelId": "ctheodoris-geneformer-v1-10m",
  "runtimeId": "single-cell-foundation-geneformer-v1-10m",
  "version": "1.0.0-beta.1",
  "sourceRevision": "04c2b2e84da7c0f385c3f9ad8f3ec24bab6650e5",
  "target": {
    "platform": "macos",
    "arch": "aarch64",
    "accelerator": "metal"
  },
  "compatibility": {
    "minLiatirVersion": "0.2.1",
    "minMacosVersion": "13.0",
    "minRamGb": 8
  },
  "pythonVersion": "3.11.9",
  "uvVersion": "0.11.28",
  "requirementsInput": "requirements.in",
  "requirementsLock": "requirements.lock",
  "pythonEntryPoint": "venv/bin/python",
  "modelCacheSubdir": "model-cache/geneformer-v1-10m",
  "assetBaseUrl": "https://assets.models.liatir.app",
  "assets": [
    {
      "url": "https://huggingface.co/ctheodoris/Geneformer/resolve/04c2b2e84da7c0f385c3f9ad8f3ec24bab6650e5/Geneformer-V1-10M/config.json",
      "relativePath": "model-cache/geneformer-v1-10m/model/config.json",
      "sizeBytes": 565,
      "sha256": "9cf69ca3bdb0215c4188b54c451b6f02adfe68b8f66011a57d0f32845133fd4b"
    },
    {
      "url": "https://huggingface.co/ctheodoris/Geneformer/resolve/04c2b2e84da7c0f385c3f9ad8f3ec24bab6650e5/Geneformer-V1-10M/model.safetensors",
      "relativePath": "model-cache/geneformer-v1-10m/model/model.safetensors",
      "sizeBytes": 41183536,
      "sha256": "a5e33a757431643b3697de7ef6127950cdc49e06e58d4266b3a3ab191b683f14"
    },
    {
      "url": "https://huggingface.co/ctheodoris/Geneformer/resolve/04c2b2e84da7c0f385c3f9ad8f3ec24bab6650e5/geneformer/gene_dictionaries_30m/token_dictionary_gc30M.pkl",
      "relativePath": "model-cache/geneformer-v1-10m/dictionaries/token_dictionary_gc30M.pkl",
      "sizeBytes": 788424,
      "sha256": "ab9dc40973fa5224d77b793e2fd114cacf3d08423ed9c4c49caf0ba9c7f218f1"
    },
    {
      "url": "https://huggingface.co/ctheodoris/Geneformer/resolve/04c2b2e84da7c0f385c3f9ad8f3ec24bab6650e5/geneformer/gene_dictionaries_30m/gene_median_dictionary_gc30M.pkl",
      "relativePath": "model-cache/geneformer-v1-10m/dictionaries/gene_median_dictionary_gc30M.pkl",
      "sizeBytes": 940965,
      "sha256": "b3b589bb5ec75040d05fc44dd6bf0184cf87f3c362cf158d196a6ed3b7fe5f39"
    },
    {
      "url": "https://huggingface.co/ctheodoris/Geneformer/resolve/04c2b2e84da7c0f385c3f9ad8f3ec24bab6650e5/geneformer/gene_dictionaries_30m/ensembl_mapping_dict_gc30M.pkl",
      "relativePath": "model-cache/geneformer-v1-10m/dictionaries/ensembl_mapping_dict_gc30M.pkl",
      "sizeBytes": 584125,
      "sha256": "eac0fb0b3007267871b6305ac0003ceba19d4f28d85686cb9067ecf142787869"
    }
  ],
  "selfTest": {
    "imports": ["torch", "transformers", "anndata", "numpy", "scipy", "pandas", "h5py", "safetensors"],
    "files": [
      "model-cache/geneformer-v1-10m/model/config.json",
      "model-cache/geneformer-v1-10m/model/model.safetensors",
      "model-cache/geneformer-v1-10m/dictionaries/token_dictionary_gc30M.pkl",
      "model-cache/geneformer-v1-10m/dictionaries/gene_median_dictionary_gc30M.pkl",
      "model-cache/geneformer-v1-10m/dictionaries/ensembl_mapping_dict_gc30M.pkl"
    ]
  }
}
